<?xml version="1.0" encoding="UTF-8"?>
<root xmlns:xsi="http://www.w3.org/2001/XMLSchema-instance" xsi:noNamespaceSchemaLocation="HW4.xsd">
<Product>
	<ProductName>Mackbook</ProductName>
	<ProductDescription>Mackbook Pro is a strong and powerful laptop</ProductDescription>
	<ReleaseDate> 2016-11-10 </ReleaseDate>
	<ProductCost currency="dollars">1150.00</ProductCost>
	<Company>
		<CompanyName>Apple</CompanyName>
		<CompanyAddress>
			<StreetName>1_Infinite Loop</StreetName>
			<City>Cupertino</City>
			<ZipCode>95014</ZipCode>
			<Country>USA</Country>
		</CompanyAddress>
	</Company>
</Product>	
<Product>
	<ProductName>Galaxy edge</ProductName>
	<ProductDescription>S6 Pro is a strong and powerful phone</ProductDescription>
	<ReleaseDate> 2016-11-11 </ReleaseDate>
	<ProductCost currency="dollars">75.00</ProductCost>
	<Company>
		<CompanyName>Samsung</CompanyName>
		<CompanyAddress>
			<StreetName>1_Infinite Loop</StreetName>
			<City>Cupertino</City>
			<ZipCode>95014</ZipCode>
			<Country>NORTHKOREA</Country>
		</CompanyAddress>
	</Company>
</Product>	
<Product>
	<ProductName>Yoga</ProductName>
	<ProductDescription>Yoga is a strong and powerful laptop</ProductDescription>
	<ReleaseDate> 2015-11-10 </ReleaseDate>
	<ProductCost currency="dollars">90.00</ProductCost>
	<Company>
		<CompanyName>Lenovo</CompanyName>
		<CompanyAddress>
			<StreetName>1_Infinite Loop</StreetName>
			<City>Cupertino</City>
			<ZipCode>95014</ZipCode>
			<Country>USA</Country>
		</CompanyAddress>
	</Company>
</Product>	
<Product>
	<ProductName>MicroMax 601</ProductName>
	<ProductDescription>Max is a strong and powerful laptop</ProductDescription>
	<ReleaseDate> 2012-11-10 </ReleaseDate>
	<ProductCost currency="dollars">1000.00</ProductCost>
	<Company>
		<CompanyName>MicroMax</CompanyName>
		<CompanyAddress>
			<StreetName>1_Infinite Loop</StreetName>
			<City>Cupertino</City>
			<ZipCode>95014</ZipCode>
			<Country>INDIA</Country>
		</CompanyAddress>
	</Company>
</Product>
<Product>
	<ProductName>MicroMax 541</ProductName>
	<ProductDescription>Max is a strong and powerful laptop</ProductDescription>
	<ReleaseDate> 2005-11-10 </ReleaseDate>
	<ProductCost currency="dollars">500.00</ProductCost>
	<Company>
		<CompanyName>MicroMax</CompanyName>
		<CompanyAddress>
			<StreetName>1_Infinite Loop</StreetName>
			<City>Cupertino</City>
			<ZipCode>95014</ZipCode>
			<Country>INDIA</Country>
		</CompanyAddress>
	</Company>
</Product>
<Product>
	<ProductName>MicroMax 601</ProductName>
	<ProductDescription>Max is a strong and powerful laptop</ProductDescription>
	<ReleaseDate> 2009-11-10 </ReleaseDate>
	<ProductCost currency="dollars">700.00</ProductCost>
	<Company>
		<CompanyName>MicroMax</CompanyName>
		<CompanyAddress>
			<StreetName>1_Infinite Loop</StreetName>
			<City>Cupertino</City>
			<ZipCode>95014</ZipCode>
			<Country>INDIA</Country>
		</CompanyAddress>
	</Company>
</Product>
<Product>
	<ProductName>Yoga 456</ProductName>
	<ProductDescription>Yoga is a strong and powerful laptop</ProductDescription>
	<ReleaseDate> 2014-11-10 </ReleaseDate>
	<ProductCost currency="dollars">680.00</ProductCost>
	<Company>
		<CompanyName>Lenovo</CompanyName>
		<CompanyAddress>
			<StreetName>1_Infinite Loop</StreetName>
			<City>Cupertino</City>
			<ZipCode>95014</ZipCode>
			<Country>USA</Country>
		</CompanyAddress>
	</Company>
</Product>	
<Product>
	<ProductName>Yoga X1</ProductName>
	<ProductDescription>Yoga is a strong and powerful laptop</ProductDescription>
	<ReleaseDate> 2016-11-10 </ReleaseDate>
	<ProductCost currency="dollars">799.00</ProductCost>
	<Company>
		<CompanyName>Lenovo</CompanyName>
		<CompanyAddress>
			<StreetName>1_Infinite Loop</StreetName>
			<City>Cupertino</City>
			<ZipCode>95014</ZipCode>
			<Country>USA</Country>
		</CompanyAddress>
	</Company>
</Product>	
<Product>
	<ProductName>Galaxy S6</ProductName>
	<ProductDescription>S6 Pro is a strong and powerful phone</ProductDescription>
	<ReleaseDate> 2016-11-11 </ReleaseDate>
	<ProductCost currency="dollars">75.00</ProductCost>
	<Company>
		<CompanyName>Samsung</CompanyName>
		<CompanyAddress>
			<StreetName>1_Infinite Loop</StreetName>
			<City>Cupertino</City>
			<ZipCode>95014</ZipCode>
			<Country>NORTHKOREA</Country>
		</CompanyAddress>
	</Company>
</Product>	
<Product>
	<ProductName>Iphone6</ProductName>
	<ProductDescription>Iphone6 Pro is a strong and powerful Phone</ProductDescription>
	<ReleaseDate> 2016-11-10 </ReleaseDate>
	<ProductCost currency="dollars">800.00</ProductCost>
	<Company>
		<CompanyName>Apple</CompanyName>
		<CompanyAddress>
			<StreetName>1_Infinite Loop</StreetName>
			<City>Cupertino</City>
			<ZipCode>95014</ZipCode>
			<Country>USA</Country>
		</CompanyAddress>
	</Company>
</Product>	
</root>
